page,row_on_page,title,episode_date,summary,transcript_url,slug,episode_type,year
1,1,The 2026 Movie Star Rankings: 35 Under 35,2026-04-07,"Sean and Amanda reconvene the movie star committee to rank the 35 most important movie stars under the age of 35. Before diving in, they declare that...",https://podscripts.co/podcasts/the-big-picture/the-2026-movie-star-rankings-35-under-35,the-2026-movie-star-rankings-35-under-35,ranking,2026
1,2,The Top 10 Movie Plot Twists and The Drama. Plus: The Super Mario Galaxy Movie Certainly Exists.,2026-04-03,"Sean and Amanda open the show by tackling some movie news headlines, including the green-lighting of a Weapons prequel at Warner Bros., speculation...",https://podscripts.co/podcasts/the-big-picture/the-top-10-movie-plot-twists-and-the-drama-plus-the-super-mario-galaxy-movie-certainly-exists,the-top-10-movie-plot-twists-and-the-drama-plus-the-super-mario-galaxy-movie-certainly-exists,ranking,2026
1,3,The Best Movies of the Year So Far. Plus: 15 We Missed!,2026-03-30,"Sean and Amanda open the show with a few movie news topics including Ryan Gosling being cast in the highly anticipated next film for the Daniels, and...",https://podscripts.co/podcasts/the-big-picture/the-best-movies-of-the-year-so-far-plus-15-we-missed,the-best-movies-of-the-year-so-far-plus-15-we-missed,ranking,2026
1,4,The 1988 Movie Draft,2026-03-26,Were drafting again! Sean and Amanda are joined by Chris Ryan and Bill Simmons to draft their favorite movies from the year 1988. Hosts: Sean Fennes...,https://podscripts.co/podcasts/the-big-picture/the-1988-movie-draft,the-1988-movie-draft,draft,2026
1,5,The Steven Spielberg Conversation,2026-03-23,Sean is joined by legendary filmmaker Steven Spielberg for an extensive conversation about his illustrious career; what excited him about making his u...,https://podscripts.co/podcasts/the-big-picture/the-steven-spielberg-conversation,the-steven-spielberg-conversation,interview,2026
1,6,Project Hail Mary Will Amaze! Amaze! Amaze! With Phil Lord and Chris Miller,2026-03-20,"Sean and Amanda open the show by reacting to a ton of movie news, including the Oscar ratings being down 9 percent from last year, the new trailer for...",https://podscripts.co/podcasts/the-big-picture/project-hail-mary-will-amaze-amaze-amaze-with-phil-lord-and-chris-miller,project-hail-mary-will-amaze-amaze-amaze-with-phil-lord-and-chris-miller,oscar,2026
1,7,The Oscar Hangover Mailbag. Plus: Dune: Part Three Is Coming!,2026-03-17,"Sean and Amanda kick off the show by reacting to a laundry list of movie news, including the new trailer for Denis Villeneuve's Dune: Part Three, st...",https://podscripts.co/podcasts/the-big-picture/the-oscar-hangover-mailbag-plus-dune-part-three-is-coming,the-oscar-hangover-mailbag-plus-dune-part-three-is-coming,oscar,2026
1,8,The 2026 Academy Awards: One Battle After Another Earns More Than a Few Small Oscars,2026-03-16,Sean and Amanda instantly react to the 98th Academy Awards and share their main takeaways from Hollywoods biggest night. They make the case for why t...,https://podscripts.co/podcasts/the-big-picture/the-2026-academy-awards-one-battle-after-another-earns-more-than-a-few-small-oscars,the-2026-academy-awards-one-battle-after-another-earns-more-than-a-few-small-oscars,oscar,2026
1,9,"Our Final 2026 Oscar Predictions: Who Will Win, and Who Should Win",2026-03-12,"Were getting close to the finish line! On todays show, Sean and Amanda give their official picks for the 98th Academy Awards. Before diving in, they...",https://podscripts.co/podcasts/the-big-picture/our-final-2026-oscar-predictions-who-will-win-and-who-should-win,our-final-2026-oscar-predictions-who-will-win-and-who-should-win,oscar,2026
1,10,"The ""Anything But Oscars"" Mailbag! Plus: Hoppers",2026-03-09,"Sean and Amanda open up the mailbag and answer your ""Anything But Oscars questions! Before diving in, they cover a handful of movie news headlines, i...",https://podscripts.co/podcasts/the-big-picture/the-anything-but-oscars-mailbag-plus-hoppers,the-anything-but-oscars-mailbag-plus-hoppers,oscar,2026
1,11,The 10 Wildest Reboots in Movie History and The Bride! Plus: A Secret Agent Second Look and the Best Doc Contenders.,2026-03-06,"On todays show, Sean and Amanda break down Maggie Gyllenhaal's fascinating new movie, The Bride!, starring Jessie Buckley and Christian Bale. They...",https://podscripts.co/podcasts/the-big-picture/the-10-wildest-reboots-in-movie-history-and-the-bride-plus-a-secret-agent-second-look-and-the-best-doc-contenders,the-10-wildest-reboots-in-movie-history-and-the-bride-plus-a-secret-agent-second-look-and-the-best-doc-contenders,standard,2026
1,12,"The 2026 Alternative Oscars, a.k.a. the 6th Annual Big Picks! Plus: The Craziest Awards Season in Years.",2026-03-03,"Sean and Amanda are joined by friend of the pod Wesley Morris for a very special episode! First, they react to the news that Paramount has won the bid...",https://podscripts.co/podcasts/the-big-picture/the-2026-alternative-oscars-aka-the-6th-annual-big-picks-plus-the-craziest-awards-season-in-years,the-2026-alternative-oscars-aka-the-6th-annual-big-picks-plus-the-craziest-awards-season-in-years,oscar,2026
1,13,"Paramount Wins Warner Bros. Now What? Plus: Scream 7, Heat 2, and Nirvanna the Band the Show the Movie With Matt Johnson!",2026-02-27,"On todays action-packed episode, Sean first reacts to Netflix backing out of the bidding for Warner Brothersclearing the path for a merger with Para...",https://podscripts.co/podcasts/the-big-picture/paramount-wins-warner-bros-now-what-plus-scream-7-heat-2-and-nirvanna-the-band-the-show-the-movie-with-matt-johnson,paramount-wins-warner-bros-now-what-plus-scream-7-heat-2-and-nirvanna-the-band-the-show-the-movie-with-matt-johnson,standard,2026
1,14,The Final Best Picture Power Rankings and a Sinners Second Look With Autumn Durald Arkapaw!,2026-02-24,"Sean and Amanda open todays jam-packed show by covering the results of the BAFTA Awards and highlighting some key takeaways, including Sean Penn's an...",https://podscripts.co/podcasts/the-big-picture/the-final-best-picture-power-rankings-and-a-sinners-second-look-with-autumn-durald-arkapaw,the-final-best-picture-power-rankings-and-a-sinners-second-look-with-autumn-durald-arkapaw,oscar,2026
1,15,Garbage Crime Returns! The Post-Heat Movie Awards and Crime 101 With Bart Layton!,2026-02-20,Sean is joined by Chris Ryan to talk garbage crime and the litany of films that have been influenced by the likes of 'Heat'. They also discuss the lif...,https://podscripts.co/podcasts/the-big-picture/garbage-crime-returns-the-post-heat-movie-awards-and-crime-101-with-bart-layton,garbage-crime-returns-the-post-heat-movie-awards-and-crime-101-with-bart-layton,interview,2026
1,16,The Oscars Snubs Draft. Plus: Sirt!,2026-02-16,"Were drafting again! Sean and Amanda are joined by Chris Ryan, Joanna Robisnon, and The Anklers Katey Rich to right the Academys wrongs by drafting...",https://podscripts.co/podcasts/the-big-picture/the-oscars-snubs-draft-plus-sirat,the-oscars-snubs-draft-plus-sirat,oscar,2026
1,17,The Heaving Wuthering Heights and the Throbbing Pillion: A Very Horny Valentine's Day Double Feature,2026-02-13,Sean and Amanda are joined by Sam Sanders from the Sam Sanders Show to break down two new horny and thorny releases. They begin the show with an exten...,https://podscripts.co/podcasts/the-big-picture/the-heaving-wuthering-heights-and-the-throbbing-pillion-a-very-horny-valentines-day-double-feature,the-heaving-wuthering-heights-and-the-throbbing-pillion-a-very-horny-valentines-day-double-feature,interview,2026
1,18,Mamma Mia! Meets The Strangers'! Its a Movie Swap!,2026-02-06,For the first time in show history were doing a listeners choice episode! We gave you four options and you ultimately decided to go with a 2008 Mo...,https://podscripts.co/podcasts/the-big-picture/mamma-mia-meets-the-strangers-its-a-movie-swap,mamma-mia-meets-the-strangers-its-a-movie-swap,interview,2026
1,19,Dumpuary Is Dead. These Movies Killed It. Plus: The Best Movies at Sundance and the Catherine OHara Hall of Fame.,2026-02-03,"Sean and Amanda open todays action-packed show by discussing the incredible box office success of Markipliers self-financed Iron Lung, and they ta...",https://podscripts.co/podcasts/the-big-picture/dumpuary-is-dead-these-movies-killed-it-plus-the-best-movies-at-sundance-and-the-catherine-ohara-hall-of-fame,dumpuary-is-dead-these-movies-killed-it-plus-the-best-movies-at-sundance-and-the-catherine-ohara-hall-of-fame,ranking,2026
1,20,The 10 Most Misused Stars in Hollywood and the Gnarly Magic of Send Help,2026-01-30,"Sean and Amanda open the show by covering A24's win in the 72-hour bidding war for Olivia Wildes The Invite at the Sundance Film Festival (1:16), r...",https://podscripts.co/podcasts/the-big-picture/the-10-most-misused-stars-in-hollywood-and-the-gnarly-magic-of-send-help,the-10-most-misused-stars-in-hollywood-and-the-gnarly-magic-of-send-help,standard,2026
2,1,The Adam Sandler Hall of Fame and Jay Kelly With Noah Baumbach!,2025-12-10,"Sean and Amanda cover Noah Baumbachs new film, Jay Kelly, starring George Clooney and Adam Sandler. They work through their mixed reactions to the...",https://podscripts.co/podcasts/the-big-picture/the-adam-sandler-hall-of-fame-and-jay-kelly-with-noah-baumbach,the-adam-sandler-hall-of-fame-and-jay-kelly-with-noah-baumbach,ranking,2025
2,2,The Truth About Netflix Buying Warner Bros. Plus: Snubs and Surprises of the Golden Globe Nominations and Jafar Panahi on It Was Just an Accident.,2025-12-08,"Sean and Amanda have an action-packed show today, and they start with the biggest piece of news: Netflixs $82.7 billion acquisition of Warner Bros. D...",https://podscripts.co/podcasts/the-big-picture/the-truth-about-netflix-buying-warner-bros-plus-snubs-and-surprises-of-the-golden-globe-nominations-and-jafar-panahi-on-it-was-just-an-accident,the-truth-about-netflix-buying-warner-bros-plus-snubs-and-surprises-of-the-golden-globe-nominations-and-jafar-panahi-on-it-was-just-an-accident,oscar,2025
2,3,The Top Five Movies of 2025,2025-12-05,"Sean and Amanda are joined by Chris Ryan and Adam Nayman to share their five favorite films from the year. But before diving in, they cover a handful...",https://podscripts.co/podcasts/the-big-picture/the-top-five-movies-of-2025,the-top-five-movies-of-2025,ranking,2025
2,4,The Avatar: The Way of Water Watch-Along!,2025-12-03,"Sean, Amanda, and Chris visit Pandora and join the Navi to watch James Camerons Avatar: The Way of Water in anticipation of his upcoming sequel, ...",https://podscripts.co/podcasts/the-big-picture/the-avatar-the-way-of-water-watch-along,the-avatar-the-way-of-water-watch-along,standard,2025
2,5,The Robert Redford Hall of Fame,2025-11-28,Sean and Amanda are joined by Tracy Letts to cover the monumental work of legendary actor Robert Redford. They celebrate the stars illustrious career...,https://podscripts.co/podcasts/the-big-picture/the-robert-redford-hall-of-fame,the-robert-redford-hall-of-fame,ranking,2025
2,6,The 25 Best Movies of the Century: No. 3 - '25th Hour,2025-11-26,"Sean and Amanda return to continue their yearlong project of listing the 25 best movies of the 21st century so far. Today, they discuss Spike Lees 2...",https://podscripts.co/podcasts/the-big-picture/the-25-best-movies-of-the-century-no-3-25th-hour,the-25-best-movies-of-the-century-no-3-25th-hour,standard,2025
2,7,"Best Picture Power Rankings and the Super-Sincerity of Sentimental Value, With Joachim Trier! Plus: Regretting Regretting You.",2025-11-24,"Sean and Amanda begin the show by discussing the imminent sale of Warner Brothers Discovery, consider the potential implications of a merger with one...",https://podscripts.co/podcasts/the-big-picture/best-picture-power-rankings-and-the-super-sincerity-of-sentimental-value-with-joachim-trier-plus-regretting-regretting-you,best-picture-power-rankings-and-the-super-sincerity-of-sentimental-value-with-joachim-trier-plus-regretting-regretting-you,oscar,2025
2,8,Wicked: For Good Is No Good. But Train Dreams Is.,2025-11-21,"Sean and Amanda are joined by Juliet Litman and return to the (not so) wonderful world of Oz to cover John M. Chus Wicked: For Good, starring Arian...",https://podscripts.co/podcasts/the-big-picture/wicked-for-good-is-no-good-but-train-dreams-is,wicked-for-good-is-no-good-but-train-dreams-is,standard,2025
2,9,The 25 Best Movies of the Century: No. 4 - 'Inglourious Basterds,2025-11-19,"Sean and Amanda return to continue their yearlong project of listing the 25 best movies of the 21st century so far. Today, they discuss Quentin Tarant...",https://podscripts.co/podcasts/the-big-picture/the-25-best-movies-of-the-century-no-4-inglourious-basterds,the-25-best-movies-of-the-century-no-4-inglourious-basterds,standard,2025
2,10,"The Top Five Ethan Hawke Movies and a Double Shot of Richard Linklater, With Ethan Hawke and Richard Linklater!",2025-11-17,"On todays action-packed show, Sean and Amanda dive deep into the two newest films from one of their favorite filmmakers, Richard Linklater. Before di...",https://podscripts.co/podcasts/the-big-picture/the-top-five-ethan-hawke-movies-and-a-double-shot-of-richard-linklater-with-ethan-hawke-and-richard-linklater,the-top-five-ethan-hawke-movies-and-a-double-shot-of-richard-linklater-with-ethan-hawke-and-richard-linklater,ranking,2025
2,11,"The Juiceless Fall Movie Season, The Running Man, and Now You See Me: Now You Dont",2025-11-14,"Sean and Amanda are joined by Van Lathan to cover two new releases that they collectively had mixed feelings about. Before diving in, though, they the...",https://podscripts.co/podcasts/the-big-picture/the-juiceless-fall-movie-season-the-running-man-and-now-you-see-me-now-you-dont,the-juiceless-fall-movie-season-the-running-man-and-now-you-see-me-now-you-dont,standard,2025
2,12,The 25 Best Movies of the Century: No. 5 - 'Lady Bird,2025-11-12,"Sean and Amanda return to continue their yearlong project of listing the 25 best movies of the 21st century so far. Today, they discuss Greta Gerwigs...",https://podscripts.co/podcasts/the-big-picture/the-25-best-movies-of-the-century-no-5-lady-bird,the-25-best-movies-of-the-century-no-5-lady-bird,standard,2025
2,13,Predator: Badlands and the 'Predator' Movie Rankings,2025-11-10,"Sean is joined by Chris Ryan to avenge their Yautja brethren on planet Genna and cover Dan Trachtenbergs Predator: Badlands, starring Elle Fanning...",https://podscripts.co/podcasts/the-big-picture/predator-badlands-and-the-predator-movie-rankings,predator-badlands-and-the-predator-movie-rankings,ranking,2025
2,14,Guillermo del Toros Frankenstein and the Best Frankenstein Movies. Plus: Jennifer Lawrence Is Ablaze in Die My Love.,2025-11-07,"Sean and Amanda are joined by Rob Mahoney to cover a pair of new releases, but before diving in, they react to two new movie trailers for Michael an...",https://podscripts.co/podcasts/the-big-picture/guillermo-del-toros-frankenstein-and-the-best-frankenstein-movies-plus-jennifer-lawrence-is-ablaze-in-die-my-love,guillermo-del-toros-frankenstein-and-the-best-frankenstein-movies-plus-jennifer-lawrence-is-ablaze-in-die-my-love,standard,2025
2,15,The 25 Best Movies of the Century: No. 6 - 'Mulholland Drive,2025-11-05,"Sean and Amanda return to continue their yearlong project of listing the 25 best movies of the 21st century so far. Today, they discuss David Lynchs...",https://podscripts.co/podcasts/the-big-picture/the-25-best-movies-of-the-century-no-6-mulholland-drive,the-25-best-movies-of-the-century-no-6-mulholland-drive,standard,2025
2,16,The 1989 Movie Draft,2025-11-03,"Were drafting again! Before diving into the draft, Sean, Amanda, and Chris react to two recent pieces of news with Disney reportedly turning down Ste...",https://podscripts.co/podcasts/the-big-picture/the-1989-movie-draft,the-1989-movie-draft,draft,2025
2,17,"Best Picture Power Rankings, Bugonia, and the New Paranoid Thriller, With Yorgos Lanthimos!",2025-10-31,"Sean and Amanda kick off the show with a brand-new version of their Best Picture Power Rankings (1:43). Then, they cover Yorgos Lanthimoss new movie,...",https://podscripts.co/podcasts/the-big-picture/best-picture-power-rankings-bugonia-and-the-new-paranoid-thriller-with-yorgos-lanthimos,best-picture-power-rankings-bugonia-and-the-new-paranoid-thriller-with-yorgos-lanthimos,oscar,2025
2,18,The 25 Best Movies of the Century: No. 7 - 'In The Mood for Love,2025-10-29,"Sean and Amanda return to continue their yearlong project of listing the 25 best movies of the 21st century so far. Today, they discuss Wong Kar-wais...",https://podscripts.co/podcasts/the-big-picture/the-25-best-movies-of-the-century-no-7-in-the-mood-for-love,the-25-best-movies-of-the-century-no-7-in-the-mood-for-love,standard,2025
2,19,A House of Dynamite Is Ready to Explode,2025-10-27,"Sean and Amanda start the show by covering the major box office success of Chainsaw Man, reacting to the news that Cinemark is opening myriad new 70...",https://podscripts.co/podcasts/the-big-picture/a-house-of-dynamite-is-ready-to-explode,a-house-of-dynamite-is-ready-to-explode,standard,2025
2,20,Springsteen: Deliver Me From Nowhere and the Music Biopic Mount Rushmore,2025-10-24,Sean and Amanda are joined by Chris Ryan and Yasi Salek to head over to 'State Trooper' town and cover Scott Coopers Springsteen: Deliver Me From No...,https://podscripts.co/podcasts/the-big-picture/springsteen-deliver-me-from-nowhere-and-the-music-biopic-mount-rushmore,springsteen-deliver-me-from-nowhere-and-the-music-biopic-mount-rushmore,standard,2025
3,1,The 25 Best Movies of the Century: No. 8 - Parasite,2025-10-22,"Sean and Amanda return to continue their yearlong project of listing the 25 best movies of the 21st century so far. Today, they discuss Bong Joon-hos...",https://podscripts.co/podcasts/the-big-picture/the-25-best-movies-of-the-century-no-8-parasite,the-25-best-movies-of-the-century-no-8-parasite,standard,2025
3,2,The 10 Best Horror Movies of 2025 and Black Phone 2,2025-10-21,"On todays show Chris Ryan joins Sean to unpack the year 2025 in horror movies. But first, they hit a handful of movie news headlines, including rumor...",https://podscripts.co/podcasts/the-big-picture/the-10-best-horror-movies-of-2025-and-black-phone-2,the-10-best-horror-movies-of-2025-and-black-phone-2,standard,2025
3,3,"The Should I See It in a Movie Theater? Test: Tron: Ares,Roofman, and After the Hunt. Plus, the Magic of Mr. Scorsese.",2025-10-17,"Sean and Amanda begin the show by honoring the legendary actor Diane Keaton, who passed away at 79 last Saturday (3:19). Then, following a disappointi...",https://podscripts.co/podcasts/the-big-picture/the-should-i-see-it-in-a-movie-theater-test-tron-ares-roofman-and-after-the-hunt-plus-the-magic-of-mr-scorsese,the-should-i-see-it-in-a-movie-theater-test-tron-ares-roofman-and-after-the-hunt-plus-the-magic-of-mr-scorsese,standard,2025
3,4,The 25 Best Movies of the Century: No. 9 - 'Mad Max: Fury Road,2025-10-14,"Sean and Amanda return to continue their yearlong project of listing the 25 best movies of the 21st century so far. Today, they discuss George Miller...",https://podscripts.co/podcasts/the-big-picture/the-25-best-movies-of-the-century-no-9-mad-max-fury-road,the-25-best-movies-of-the-century-no-9-mad-max-fury-road,standard,2025
3,5,The Daniel Day-Lewis Hall of Fame,2025-10-10,Sean and Amanda are joined by David Sims of the Blank Check podcast to commemorate the incredible career of Daniel Day-Lewis. They begin the show by d...,https://podscripts.co/podcasts/the-big-picture/the-daniel-day-lewis-hall-of-fame,the-daniel-day-lewis-hall-of-fame,ranking,2025
3,6,"The New York City Movie Draft, With Griffin Newman and David Sims!",2025-10-07,"Live from New York, its 'Saturday Night'! Sean and Amanda are joined by Chris Ryan, plus Griffin Newman and David Sims of the Blank Check podcast, to...",https://podscripts.co/podcasts/the-big-picture/the-new-york-city-movie-draft-with-griffin-newman-and-david-sims,the-new-york-city-movie-draft-with-griffin-newman-and-david-sims,draft,2025
3,7,One Battle After Another: A Second Opinion With Van Lathan,2025-10-05,"On a very special bonus episode of the podcast, Van Lathan joins the show and gets the chance to share his perspective on the box office debate for O...",https://podscripts.co/podcasts/the-big-picture/one-battle-after-another-a-second-opinion-with-van-lathan,one-battle-after-another-a-second-opinion-with-van-lathan,interview,2025
3,8,"Best Picture Power Rankings and The Rocks Oscar Bid in The Smashing Machine, with Benny Safdie!",2025-10-03,"Sean and Amanda get in the ring with Van Lathan to go multiple rounds on Benny Safdies new film, The Smashing Machine, starring Dwayne The Rock J...",https://podscripts.co/podcasts/the-big-picture/best-picture-power-rankings-and-the-rocks-oscar-bid-in-the-smashing-machine-with-benny-safdie,best-picture-power-rankings-and-the-rocks-oscar-bid-in-the-smashing-machine-with-benny-safdie,oscar,2025
3,9,The 25 Best Movies of the Century: No. 10 - 'Marie Antoinette,2025-10-01,"Sean and Amanda return to continue their yearlong project of listing the 25 best movies of the 21st century so far. Today, they discuss Sofia Coppola...",https://podscripts.co/podcasts/the-big-picture/the-25-best-movies-of-the-century-no-10-marie-antoinette,the-25-best-movies-of-the-century-no-10-marie-antoinette,standard,2025
3,10,"One Mailbag After Another, and the Updated PTA Movie Rankings",2025-09-29,Sean and Amanda have an action-packed episode today following the release of Paul Thomas Andersons One Battle After Another.' They begin the show by...,https://podscripts.co/podcasts/the-big-picture/one-mailbag-after-another-and-the-updated-pta-movie-rankings,one-mailbag-after-another-and-the-updated-pta-movie-rankings,mailbag,2025
3,11,"One Battle After Another Is a Modern Masterpiece, With Leonardo DiCaprio and Paul Thomas Anderson!",2025-09-26,"Sean and Amanda are joined by Chris Ryan to break down their most anticipated movie of the year: Paul Thomas Andersons One Battle After Another, st...",https://podscripts.co/podcasts/the-big-picture/one-battle-after-another-is-a-modern-masterpiece-with-leonardo-dicaprio-and-paul-thomas-anderson,one-battle-after-another-is-a-modern-masterpiece-with-leonardo-dicaprio-and-paul-thomas-anderson,interview,2025
3,12,The 25 Best Movies of the Century: No. 11 - 'The Wolf of Wall Street,2025-09-24,"Sean and Amanda return to continue their yearlong project of listing the 25 best movies of the 21st century so far. Today, they discuss Martin Scorses...",https://podscripts.co/podcasts/the-big-picture/the-25-best-movies-of-the-century-no-11-the-wolf-of-wall-street,the-25-best-movies-of-the-century-no-11-the-wolf-of-wall-street,standard,2025
3,13,The 25 Best Movies of the Century: No. 12 - 'The Wolf of Wall Street,2025-09-24,"Sean and Amanda return to continue their yearlong project of listing the 25 best movies of the 21st century so far. Today, they discuss Martin Scorses...",https://podscripts.co/podcasts/the-big-picture/the-25-best-movies-of-the-century-no-12-the-wolf-of-wall-street,the-25-best-movies-of-the-century-no-12-the-wolf-of-wall-street,standard,2025
3,14,We Almost Missed These 10 Movies. Should You?,2025-09-22,"On todays show, Sean and Amanda talk through 10 movies that have come out over the past few months that they havent covered on the show yet. But bef...",https://podscripts.co/podcasts/the-big-picture/we-almost-missed-these-10-movies-should-you,we-almost-missed-these-10-movies-should-you,standard,2025
3,15,The Physical Media High Council Awards,2025-09-19,"Sean is joined by Chris Ryan, Tracy Letts, and Tim Simons for a very special episode dedicated to all things physical media. They talk through the cur...",https://podscripts.co/podcasts/the-big-picture/the-physical-media-high-council-awards,the-physical-media-high-council-awards,standard,2025
3,16,The 25 Best Movies of the Century: No. 12 - 'The Royal Tenenbaums,2025-09-17,"Sean and Amanda return to continue their yearlong project of listing the 25 best movies of the 21st century so far. Today, they discuss Wes Andersons...",https://podscripts.co/podcasts/the-big-picture/the-25-best-movies-of-the-century-no-12-the-royal-tenenbaums,the-25-best-movies-of-the-century-no-12-the-royal-tenenbaums,standard,2025
3,17,Is Weapons a Classic? And an Oscar Contender? Plus: The Best Movies at TIFF!,2025-09-15,Adam Nayman joins the show to recap his experience at this years Toronto International Film Festival. He breaks down the fanatical scene at the trave...,https://podscripts.co/podcasts/the-big-picture/is-weapons-a-classic-and-an-oscar-contender-plus-the-best-movies-at-tiff,is-weapons-a-classic-and-an-oscar-contender-plus-the-best-movies-at-tiff,oscar,2025
3,18,The Paul Thomas Anderson Movie Character Draft,2025-09-12,"For the first time ever, Sean, Amanda, and Chris are doing a movie character draft! Today, they draft their favorite characters from Paul Thomas Ander...",https://podscripts.co/podcasts/the-big-picture/the-paul-thomas-anderson-movie-character-draft,the-paul-thomas-anderson-movie-character-draft,draft,2025
3,19,The Robert Altman Hall of Fame,2025-09-09,"Sean and Amanda celebrate legendary filmmaker Robert Altman, who would have turned 100 this year, by breaking down his illustrious career. But first,...",https://podscripts.co/podcasts/the-big-picture/the-robert-altman-hall-of-fame,the-robert-altman-hall-of-fame,ranking,2025
3,20,"Highest 2 Lowest Is a N.Y. Movie State of Mind, With Spike Lee!",2025-09-05,"Sean and Amanda start the show by reacting to a handful of recent movie trailers, including Emerald Fennells Wuthering Heightsstarring Margot Robb...",https://podscripts.co/podcasts/the-big-picture/highest-2-lowest-is-a-ny-movie-state-of-mind-with-spike-lee,highest-2-lowest-is-a-ny-movie-state-of-mind-with-spike-lee,interview,2025
