page,row_on_page,title,episode_date,summary,transcript_url,slug,episode_type,year
33,7,Top 10 Horny Quarantine Erotic Thrillers | The Big Picture,2020-04-17,"All across the country, millions of Americans are bunkered down in their homes. Some of those people are alone. Some are cocooned with their partners....",https://podscripts.co/podcasts/the-big-picture/top-10-horny-quarantine-erotic-thrillers-the-big-picture,top-10-horny-quarantine-erotic-thrillers-the-big-picture,ranking,2020
33,8,Movie Apocalypse: 'Trolls World Tour' Is the Most Important Film of 2020 | The Big Picture,2020-04-14,"The 'Trolls' sequel wouldn't normally be a topic of serious interrogation on the show, but with new theatrical releases on hold, 'Trolls World Tour' h...",https://podscripts.co/podcasts/the-big-picture/movie-apocalypse-trolls-world-tour-is-the-most-important-film-of-2020-the-big-picture,movie-apocalypse-trolls-world-tour-is-the-most-important-film-of-2020-the-big-picture,interview,2020
33,9,Criterion Channel Is a Streaming Miracle. Here are 25 Movies You Should Watch Now | The Big Picture,2020-04-10,The Criterion Channel streaming service is celebrating its one-year anniversary this week and it has been a shelter in a storm for movie lovers during...,https://podscripts.co/podcasts/the-big-picture/criterion-channel-is-a-streaming-miracle-here-are-25-movies-you-should-watch-now-the-big-picture,criterion-channel-is-a-streaming-miracle-here-are-25-movies-you-should-watch-now-the-big-picture,standard,2020
33,10,Movie Swap: 'Aliens' vs. 'Four Weddings and a Funeral' | The Big Picture,2020-04-07,"Hollywood has officially canceled summer movie season, so we're going back to old favorites and exposing each other to new experiences. For their late...",https://podscripts.co/podcasts/the-big-picture/movie-swap-aliens-vs-four-weddings-and-a-funeral-the-big-picture,movie-swap-aliens-vs-four-weddings-and-a-funeral-the-big-picture,standard,2020
33,11,100 Years of Genius: The Toshiro Mifune Hall of Fame | The Big Picture,2020-04-03,"The Japanese superstar would have turned 100 years old this week, so for our 250th episode, Mifune's centenary is as good a time as we're ever going t...",https://podscripts.co/podcasts/the-big-picture/100-years-of-genius-the-toshiro-mifune-hall-of-fame-the-big-picture,100-years-of-genius-the-toshiro-mifune-hall-of-fame-the-big-picture,ranking,2020
33,12,"Screw It, We're Giving Out 2021 Oscars Right Now | The Big Picture",2020-03-31,"New movie releases have slowed to a crawl, but we do have a quarter of a year's worth to judge. Sean and Amanda have scanned the results and decided t...",https://podscripts.co/podcasts/the-big-picture/screw-it-were-giving-out-2021-oscars-right-now-the-big-picture,screw-it-were-giving-out-2021-oscars-right-now-the-big-picture,oscar,2020
33,13,The Movie Star Ranking: 35 Under 35 | The Big Picture,2020-03-27,"With no new movies on the horizon, we have resorted to ridiculous rankings. First up, a completely unscientific but emotionally charged rundown of the...",https://podscripts.co/podcasts/the-big-picture/the-movie-star-ranking-35-under-35-the-big-picture,the-movie-star-ranking-35-under-35-the-big-picture,ranking,2020
33,14,We're Watching Every New Movie at Home Now. Is That a Good Thing? Plus: Bill Simmons on 'The Hunt.' | The Big Picture,2020-03-24,"Suddenly, nearly every 2020 movie that's been released is available at home. Sean and Amanda break down our new (hopefully temporary) reality of home...",https://podscripts.co/podcasts/the-big-picture/were-watching-every-new-movie-at-home-now-is-that-a-good-thing-plus-bill-simmons-on-the-hunt-the-big-picture,were-watching-every-new-movie-at-home-now-is-that-a-good-thing-plus-bill-simmons-on-the-hunt-the-big-picture,standard,2020
33,15,100 Movies for You: A Streaming Recommendation Mega-Mailbag | The Big Picture,2020-03-20,"You asked and we answered. After diving into the mailbag, Sean and Amanda tackled all your questions and came up with dozens of movies to watch during...",https://podscripts.co/podcasts/the-big-picture/100-movies-for-you-a-streaming-recommendation-mega-mailbag-the-big-picture,100-movies-for-you-a-streaming-recommendation-mega-mailbag-the-big-picture,mailbag,2020
33,16,"Movie Theaters Are Closed. When They Reopen, Will the Movies Follow? | The Big Picture",2020-03-17,"With virtually every major new release pushed back and the box office recording a record low over the weekend, movie theaters have shuttered around th...",https://podscripts.co/podcasts/the-big-picture/movie-theaters-are-closed-when-they-reopen-will-the-movies-follow-the-big-picture,movie-theaters-are-closed-when-they-reopen-will-the-movies-follow-the-big-picture,interview,2020
33,17,Hollywood Is Pressing Pause. So Stream These Movies. | The Big Picture,2020-03-13,The coronavirus and new social distancing measures have led most major studios to delay their spring theatrical releases. With blockbuster titles like...,https://podscripts.co/podcasts/the-big-picture/hollywood-is-pressing-pause-so-stream-these-movies-the-big-picture,hollywood-is-pressing-pause-so-stream-these-movies-the-big-picture,interview,2020
33,18,How the Coronavirus Is Affecting the Movie Industry. Plus: 'Onward' and the Future of Pixar. | The Big Picture,2020-03-10,"The spread of COVID-19 has struck virtually every part of communal life, including the movie theater. With more people staying home to watch movies, S...",https://podscripts.co/podcasts/the-big-picture/how-the-coronavirus-is-affecting-the-movie-industry-plus-onward-and-the-future-of-pixar-the-big-picture,how-the-coronavirus-is-affecting-the-movie-industry-plus-onward-and-the-future-of-pixar-the-big-picture,standard,2020
33,19,Top Five Mark Wahlberg Movies: Say Hi to Your Mother for Us | The Big Picture,2020-03-06,"Mark Wahlberg is one of the most unlikely movie stars of the century, mixing serious drama, comedy, action, and highbrow films across his long career....",https://podscripts.co/podcasts/the-big-picture/top-five-mark-wahlberg-movies-say-hi-to-your-mother-for-us-the-big-picture,top-five-mark-wahlberg-movies-say-hi-to-your-mother-for-us-the-big-picture,ranking,2020
33,20,Ben Affleck and Life After Batman in 2020; Plus: Bill Simmons on 'The Invisible Man' | The Big Picture,2020-03-03,"As his new drama, 'The Way Back,' nears release, Ben Affleck is back in the spotlight and opening up about his struggles with substance misuse. It's t...",https://podscripts.co/podcasts/the-big-picture/ben-affleck-and-life-after-batman-in-2020-plus-bill-simmons-on-the-invisible-man-the-big-picture,ben-affleck-and-life-after-batman-in-2020-plus-bill-simmons-on-the-invisible-man-the-big-picture,standard,2020
34,1,The Monster Movie Hall of Fame and 'The Invisible Man' | The Big Picture,2020-02-28,"To celebrate the release of 'The Invisible Man,' Leigh Whannell's clever reimagining of the classic Universal monster movie, Adam Nayman joins the sho...",https://podscripts.co/podcasts/the-big-picture/the-monster-movie-hall-of-fame-and-the-invisible-man-the-big-picture,the-monster-movie-hall-of-fame-and-the-invisible-man-the-big-picture,ranking,2020
34,2,Top Five Movie Soundtrack Needle Drops. Plus: Robbie Robertson | The Big Picture,2020-02-25,The art of placing music in a movie is harder than it looks. 'Ringer' staff writer Rob Harvilla joins Sean to explore the rules of a great needle drop...,https://podscripts.co/podcasts/the-big-picture/top-five-movie-soundtrack-needle-drops-plus-robbie-robertson-the-big-picture,top-five-movie-soundtrack-needle-drops-plus-robbie-robertson-the-big-picture,ranking,2020
34,3,"Introducing the Movie Director Game, With Sam Esmail | The Big Picture",2020-02-21,"Movies have the February blues, so we enlisted a friend of the show to liven things up. 'Mr. Robot' creator and movie fanatic Sam Esmail joins Sean an...",https://podscripts.co/podcasts/the-big-picture/introducing-the-movie-director-game-with-sam-esmail-the-big-picture,introducing-the-movie-director-game-with-sam-esmail-the-big-picture,interview,2020
34,4,Welcome to Dumpuary: Breaking Down a Bad Movie Buffet | The Big Picture,2020-02-18,"The Oscars are a distant memory, but we are still trapped in February, a typically scary time for movie lovers. Sean and Amanda explore the good, the...",https://podscripts.co/podcasts/the-big-picture/welcome-to-dumpuary-breaking-down-a-bad-movie-buffet-the-big-picture,welcome-to-dumpuary-breaking-down-a-bad-movie-buffet-the-big-picture,oscar,2020
34,5,Have the Academy Awards Changed for Good? A Post-'Parasite' Oscars Mailbag | The Big Picture,2020-02-12,"Still awash in the 'Parasite' afterglow, we drill down on some of the lingering questions from the 92nd Oscars submitted by you, the listeners (1:17)....",https://podscripts.co/podcasts/the-big-picture/have-the-academy-awards-changed-for-good-a-post-parasite-oscars-mailbag-the-big-picture,have-the-academy-awards-changed-for-good-a-post-parasite-oscars-mailbag-the-big-picture,oscar,2020
34,6,"The 2020 Oscars: Holy S***, Parasite Won! | The Big Picture",2020-02-10,"In a shocking and exhilarating finale to the 92nd Academy Awards, Parasite and Bong Joon-ho won Best Picture, capping off an amazing Cinderella run...",https://podscripts.co/podcasts/the-big-picture/the-2020-oscars-holy-s-parasite-won-the-big-picture,the-2020-oscars-holy-s-parasite-won-the-big-picture,oscar,2020
34,7,Predicting the 2020 Oscars | The Big Picture,2020-02-07,"In our final show before the 92nd Oscars, we run down every category and predict what we think will win each award. Will it be a historic night for 'P...",https://podscripts.co/podcasts/the-big-picture/predicting-the-2020-oscars-the-big-picture,predicting-the-2020-oscars-the-big-picture,oscar,2020
34,8,Our Alternative Academy Awards | The Oscars Show,2020-02-05,"Now that we know how this weekends Oscar ceremony is lining up, were ready to share some ideas of our own. Wesley Morris joins Sean and Amanda for t...",https://podscripts.co/podcasts/the-big-picture/our-alternative-academy-awards-the-oscars-show,our-alternative-academy-awards-the-oscars-show,oscar,2020
34,9,The Idiot's Guide to Winning Best Picture. Plus: We Make the Case for 'Parasite.' | The Oscars Show,2020-02-03,"'1917' has run roughshod over the preliminary awards shows, dominating at the BAFTAs over the weekend. Does a WGAs win for 'Parasite' create any dayli...",https://podscripts.co/podcasts/the-big-picture/the-idiots-guide-to-winning-best-picture-plus-we-make-the-case-for-parasite-the-oscars-show,the-idiots-guide-to-winning-best-picture-plus-we-make-the-case-for-parasite-the-oscars-show,oscar,2020
34,10,The Five Most Important Movies at Sundance | The Big Picture,2020-01-31,"We have returned from Sundance and we have seen the movies. Some of them, at least. Sean and Amanda break down the Sundance movie archetypes and share...",https://podscripts.co/podcasts/the-big-picture/the-five-most-important-movies-at-sundance-the-big-picture,the-five-most-important-movies-at-sundance-the-big-picture,standard,2020
34,11,Has '1917' Already Locked Up Best Picture? And Is That Bad for the Academy Awards? | The Oscars Show,2020-01-27,"After a victory at the Directors Guild of America Awards, Sam Mendes's '1917' seems poised for dominance on Oscar night. How did the most exciting rac...",https://podscripts.co/podcasts/the-big-picture/has-1917-already-locked-up-best-picture-and-is-that-bad-for-the-academy-awards-the-oscars-show,has-1917-already-locked-up-best-picture-and-is-that-bad-for-the-academy-awards-the-oscars-show,oscar,2020
34,12,The 15 Most Anticipated Movies at Sundance. Plus: Randy Newman! | The Big Picture,2020-01-24,"We've touched down in Park City, Utah, for the Sundance Film Festival and we're ready to watch some movies. Sean and Amanda break down what it means t...",https://podscripts.co/podcasts/the-big-picture/the-15-most-anticipated-movies-at-sundance-plus-randy-newman-the-big-picture,the-15-most-anticipated-movies-at-sundance-plus-randy-newman-the-big-picture,standard,2020
34,13,'Parasite' vs. '1917' : The Best Picture Showdown Is Here. Plus: It's Mailbag Time | The Oscars Show,2020-01-21,"After a busy weekend for guild awards ceremonies, we have a new front-runner, '1917,' which scored a big win at the Producers Guild Awards. But 'Paras...",https://podscripts.co/podcasts/the-big-picture/parasite-vs-1917-the-best-picture-showdown-is-here-plus-its-mailbag-time-the-oscars-show,parasite-vs-1917-the-best-picture-showdown-is-here-plus-its-mailbag-time-the-oscars-show,oscar,2020
34,14,The 20 Most Anticipated Movies of 2020 | The Big Picture,2020-01-17,"A new movie year is upon us, and just like that we have our first disaster: 'Dolittle.' Sean and Amanda break down the Robert Downey Jr.talking anima...",https://podscripts.co/podcasts/the-big-picture/the-20-most-anticipated-movies-of-2020-the-big-picture,the-20-most-anticipated-movies-of-2020-the-big-picture,standard,2020
34,15,'1917' and the Roger Deakins Hall of Fame (SPOILERS) | The Big Picture,2020-01-15,"Sam Mendes's extraordinary World War I drama, designed and shot to look as if it is unfolding in one seamless take, has crashed the Oscars party and d...",https://podscripts.co/podcasts/the-big-picture/1917-and-the-roger-deakins-hall-of-fame-spoilers-the-big-picture,1917-and-the-roger-deakins-hall-of-fame-spoilers-the-big-picture,oscar,2020
34,16,The Snubs and Surprises of the 92nd Academy Award Nominations | The Oscars Show,2020-01-13,"Sean and Amanda break down all the surprises and snubs (RIP, 'Uncut Gems') among a complicated collection of Oscar nominations, including the overwhel...",https://podscripts.co/podcasts/the-big-picture/the-snubs-and-surprises-of-the-92nd-academy-award-nominations-the-oscars-show,the-snubs-and-surprises-of-the-92nd-academy-award-nominations-the-oscars-show,oscar,2020
34,17,Predicting the Nominations For the 2020 Oscars | The Big Picture,2020-01-10,"With the 2020 Oscar nominations set to be announced Monday morning, we run down a list of 15 categories and attempt to predict which films, filmmakers...",https://podscripts.co/podcasts/the-big-picture/predicting-the-nominations-for-the-2020-oscars-the-big-picture,predicting-the-nominations-for-the-2020-oscars-the-big-picture,oscar,2020
34,18,2020 Golden Globes: Winners and Losers | The Oscars Show,2020-01-06,"Sean and Amanda recap a night in which '1917' won big, taking home both Best Motion PictureDrama and Best Director. What does this mean, if anything,...",https://podscripts.co/podcasts/the-big-picture/2020-golden-globes-winners-and-losers-the-oscars-show,2020-golden-globes-winners-and-losers-the-oscars-show,oscar,2020
34,19,2020 Golden Globes Predictions | The Big Picture,2020-01-03,"The new year is here, and with it the most fraught awards show of the season. Ricky Gervais returns to host and Sean and Amanda return to make some (p...",https://podscripts.co/podcasts/the-big-picture/2020-golden-globes-predictions-the-big-picture,2020-golden-globes-predictions-the-big-picture,interview,2020
34,20,Was 2019 the Best Movie Year of the Decade? Plus: 'The Rise of Skywalker' Aftermath. | The Oscars Show,2019-12-30,Sean and Amanda close out the year by breaking down the tepid reception and complicated franchise future of 'Star Wars' in the aftermath of 'The Rise...,https://podscripts.co/podcasts/the-big-picture/was-2019-the-best-movie-year-of-the-decade-plus-the-rise-of-skywalker-aftermath-the-oscars-show,was-2019-the-best-movie-year-of-the-decade-plus-the-rise-of-skywalker-aftermath-the-oscars-show,oscar,2019
35,1,The Genius of 'Uncut Gems.' Plus: the Safdie Brothers! | The Big Picture,2019-12-26,"This is how the Safdies win. Sean shares the 12 highly specific things he loves (with spoilers!) about the New York brothers' new film (0:55). Then, J...",https://podscripts.co/podcasts/the-big-picture/the-genius-of-uncut-gems-plus-the-safdie-brothers-the-big-picture,the-genius-of-uncut-gems-plus-the-safdie-brothers-the-big-picture,standard,2019
35,2,Why 'Little Women' Matters. Plus: Greta Gerwig! | The Big Picture,2019-12-23,It's been 25 years since the last Hollywood adaptation of Louisa May Alcott's novel about the March sisters. Why did Greta Gerwig want to tackle this...,https://podscripts.co/podcasts/the-big-picture/why-little-women-matters-plus-greta-gerwig-the-big-picture,why-little-women-matters-plus-greta-gerwig-the-big-picture,standard,2019
35,3,"'Cats': Seriously, WTF? | The Big Picture",2019-12-20,Tom Hooper's adaptation of Andrew Lloyd Webber's smash musical hit has finally come to movie theaters and well yikes. Sean and Amanda break down t...,https://podscripts.co/podcasts/the-big-picture/cats-seriously-wtf-the-big-picture,cats-seriously-wtf-the-big-picture,standard,2019
35,4,'Star Wars: The Rise of Skywalker' Emergency Deep Dive (SPOILERS) | The Big Picture,2019-12-20,"'Episode IX' is here and, well, it's not all we'd hoped and dreamed it would be. To break down J.J. Abrams's film, the ninth and final installment in...",https://podscripts.co/podcasts/the-big-picture/star-wars-the-rise-of-skywalker-emergency-deep-dive-spoilers-the-big-picture,star-wars-the-rise-of-skywalker-emergency-deep-dive-spoilers-the-big-picture,standard,2019
35,5,"'Bombshell,' 'Richard Jewell,' and What Happens When Movies Mess With the Media | The Oscar Show",2019-12-17,"Bryan Curtis stops by to talk about 'Richard Jewell' and 'Bombshell,' two new films about the media, the Kathy Scruggs controversy at the center of Cl...",https://podscripts.co/podcasts/the-big-picture/bombshell-richard-jewell-and-what-happens-when-movies-mess-with-the-media-the-oscar-show,bombshell-richard-jewell-and-what-happens-when-movies-mess-with-the-media-the-oscar-show,oscar,2019
35,6,Netflix + Michael Bay = 2019's Wildest Movie a.k.a 6 Underground | The Big Picture,2019-12-13,The grand master of ridiculous action movies is back and hes teamed up with Netflix. Sean and Amanda are joined by Chris Ryan to break down every asp...,https://podscripts.co/podcasts/the-big-picture/netflix-michael-bay-2019s-wildest-movie-aka-6-underground-the-big-picture,netflix-michael-bay-2019s-wildest-movie-aka-6-underground-the-big-picture,interview,2019
35,7,Golden Globes Nominations Snubs and Surprises | The Oscars Show,2019-12-09,"The Golden Globe nominations are here, and they're as dumb as ever. But will they matter come Oscars time? Amanda and Sean break down all the nominees...",https://podscripts.co/podcasts/the-big-picture/golden-globes-nominations-snubs-and-surprises-the-oscars-show,golden-globes-nominations-snubs-and-surprises-the-oscars-show,oscar,2019
35,8,The Top Five Movies of the Year | The Big Picture,2019-12-06,"Chris Ryan and Adam Nayman join Sean and Amanda to rank their top five movies of 2019, which got off to a slow start but has been flooded with great f...",https://podscripts.co/podcasts/the-big-picture/the-top-five-movies-of-the-year-the-big-picture,the-top-five-movies-of-the-year-the-big-picture,ranking,2019
35,9,'The Irishman' Is NOT Too Long. Plus: Predicting the Golden Globe Nominations. | The Oscars Show,2019-12-03,We're less than a week away from the official start of awards season: Golden Globe nominations. Amanda and Sean share their best guesses in the major...,https://podscripts.co/podcasts/the-big-picture/the-irishman-is-not-too-long-plus-predicting-the-golden-globe-nominations-the-oscars-show,the-irishman-is-not-too-long-plus-predicting-the-golden-globe-nominations-the-oscars-show,oscar,2019
35,10,The Top 10 Movies of the Decade | The Big Picture,2019-11-26,"Sean and Amanda are joined by Chris Ryan to discuss, debate, and ultimately crown the 10 best films of the decade as they see them. Hosts: Sean Fennes...",https://podscripts.co/podcasts/the-big-picture/the-top-10-movies-of-the-decade-the-big-picture,the-top-10-movies-of-the-decade-the-big-picture,ranking,2019
35,11,Top Five Murder Mysteries. Plus: Rian Johnson on Knives Out | The Big Picture,2019-11-25,We convene to share our top five murder mystery films and judge the category with ranging specificity (1:15). Then writer-director Rian Johnson joins...,https://podscripts.co/podcasts/the-big-picture/top-five-murder-mysteries-plus-rian-johnson-on-knives-out-the-big-picture,top-five-murder-mysteries-plus-rian-johnson-on-knives-out-the-big-picture,ranking,2019
35,12,The Tom Hanks Hall of Fame. Plus: The Snubs and Surprises of the Independent Spirit Award Nominations. | The Big Picture,2019-11-22,"The Spirit Awards typically act as Oscars counterprogramming, rewarding outliers and underseen indies in the race. Sean and Amanda break down the 2020...",https://podscripts.co/podcasts/the-big-picture/the-tom-hanks-hall-of-fame-plus-the-snubs-and-surprises-of-the-independent-spirit-award-nominations-the-big-picture,the-tom-hanks-hall-of-fame-plus-the-snubs-and-surprises-of-the-independent-spirit-award-nominations-the-big-picture,oscar,2019
35,13,"The Seven ""on the Bubble"" Oscar Contenders. Plus: #ReleaseTheSnyderCut ... or Something | The Oscars Show",2019-11-19,"The Oscars are closer than you thinkjust 82 more days!so Sean and Amanda take a closer look at the chances of 'Ford v. Ferrari,' 'Waves,' and five m...",https://podscripts.co/podcasts/the-big-picture/the-seven-on-the-bubble-oscar-contenders-plus-releasethesnydercut-or-something-the-oscars-show,the-seven-on-the-bubble-oscar-contenders-plus-releasethesnydercut-or-something-the-oscars-show,oscar,2019
35,14,Top Five Matt Damon Movies and James Mangold on Ford v Ferrari | The Big Picture,2019-11-15,"With the release of the Christian BaleMatt Damon racing two-hander, we look back on Damons best performances, including the iconic Good Will Huntin...",https://podscripts.co/podcasts/the-big-picture/top-five-matt-damon-movies-and-james-mangold-on-ford-v-ferrari-the-big-picture,top-five-matt-damon-movies-and-james-mangold-on-ford-v-ferrari-the-big-picture,ranking,2019
35,15,Will Disney+ and Netflix Force the Academy Awards to Recognize Streaming? Plus: Why 'Doctor Sleep' Dozed Off | The Oscars Show,2019-11-12,The launch of Disney's new streaming service raises fascinating questions about the future of streaming and awards season. Sean and Amanda dive in by...,https://podscripts.co/podcasts/the-big-picture/will-disney-and-netflix-force-the-academy-awards-to-recognize-streaming-plus-why-doctor-sleep-dozed-off-the-oscars-show,will-disney-and-netflix-force-the-academy-awards-to-recognize-streaming-plus-why-doctor-sleep-dozed-off-the-oscars-show,oscar,2019
35,16,'Marriage Story' Destroyed Us. Plus: Noah Baumbach on His Divorce Opus. | The Big Picture,2019-11-08,Writer-director Noah Baumbach's latest is one of the year's best and most emotionally devastating films. The Netflix release stars Adam Driver and Sca...,https://podscripts.co/podcasts/the-big-picture/marriage-story-destroyed-us-plus-noah-baumbach-on-his-divorce-opus-the-big-picture,marriage-story-destroyed-us-plus-noah-baumbach-on-his-divorce-opus-the-big-picture,standard,2019
35,17,Netflix's 'The Irishman' Is Alive and WellAre Movie Theaters Dead? Plus: Antonio Banderas! | The Oscars Show,2019-11-05,Martin Scorsese's 'The Irishman' is already being hailed as a sophisticated masterworkby Sean and Amanda and dozens of criticsthat will challenge fo...,https://podscripts.co/podcasts/the-big-picture/netflixs-the-irishman-is-alive-and-well-are-movie-theaters-dead-plus-antonio-banderas-the-oscars-show,netflixs-the-irishman-is-alive-and-well-are-movie-theaters-dead-plus-antonio-banderas-the-oscars-show,oscar,2019
35,18,Top Five Martin Scorsese Movies. Plus: Edward Norton! | The Big Picture,2019-11-01,"'The Irishman' opens in theaters this weekend, so Sean has convened two Scorsese fanatics, Chris Ryan and Adam Nayman, to share their top five favorit...",https://podscripts.co/podcasts/the-big-picture/top-five-martin-scorsese-movies-plus-edward-norton-the-big-picture,top-five-martin-scorsese-movies-plus-edward-norton-the-big-picture,ranking,2019
35,19,Eleven Reckless Oscar Predictions. Plus: Bong Joon-ho! | The Oscars Show,2019-10-29,The nominations are flowing and we're already drunk with takes. Amanda and Sean look at the Gotham Awards noms and the Academy's Governors Awards and...,https://podscripts.co/podcasts/the-big-picture/eleven-reckless-oscar-predictions-plus-bong-joon-ho-the-oscars-show,eleven-reckless-oscar-predictions-plus-bong-joon-ho-the-oscars-show,oscar,2019
35,20,The 10 Best Horror Movies of the Decade | The Big Picture,2019-10-25,"The '10s are nearly over, and horror has been one of the decade's most dominant genres. Chris Ryan teams up with Sean to break down the very best the...",https://podscripts.co/podcasts/the-big-picture/the-10-best-horror-movies-of-the-decade-the-big-picture,the-10-best-horror-movies-of-the-decade-the-big-picture,interview,2019
36,1,"What Do Disney Sequels, Zombies, a Nazi Comedy, and Steven Soderbergh Have in Common? | The Big Picture",2019-10-18,"Political subtext is everywhere, even at the movies. The weekend's four big releases'Maleficent: Mistress of Evil'; 'Jojo Rabbit'; 'The Laundromat';...",https://podscripts.co/podcasts/the-big-picture/what-do-disney-sequels-zombies-a-nazi-comedy-and-steven-soderbergh-have-in-common-the-big-picture,what-do-disney-sequels-zombies-a-nazi-comedy-and-steven-soderbergh-have-in-common-the-big-picture,standard,2019
36,2,'Parasite' Is the Movie of the YearWill the Oscars Agree? | The Oscars Show,2019-10-15,"After winning the Palme d'Or at Cannes, soaring to international box office success, and riding a wave of extraordinary festival buzz, Bong Joon-ho's...",https://podscripts.co/podcasts/the-big-picture/parasite-is-the-movie-of-the-year-will-the-oscars-agree-the-oscars-show,parasite-is-the-movie-of-the-year-will-the-oscars-agree-the-oscars-show,oscar,2019
